{
  "schema": "aisi.trace/1",
  "system_id": "hr-management-system",
  "generated_at": "2026-08-23T20:38:56",
  "edges": [
    {
      "from": "REQ-001",
      "to": "MOD-00",
      "relation": "satisfy",
      "evidence": "MOD-00.requirements"
    },
    {
      "from": "REQ-002",
      "to": "MOD-00",
      "relation": "satisfy",
      "evidence": "MOD-00.requirements"
    },
    {
      "from": "REQ-002.1",
      "to": "MOD-00",
      "relation": "satisfy",
      "evidence": "MOD-00.requirements"
    },
    {
      "from": "REQ-002.2",
      "to": "MOD-00",
      "relation": "satisfy",
      "evidence": "MOD-00.requirements"
    },
    {
      "from": "REQ-004",
      "to": "MOD-00",
      "relation": "satisfy",
      "evidence": "MOD-00.requirements"
    },
    {
      "from": "REQ-004.1",
      "to": "MOD-00",
      "relation": "satisfy",
      "evidence": "MOD-00.requirements"
    },
    {
      "from": "REQ-004.2",
      "to": "MOD-00",
      "relation": "satisfy",
      "evidence": "MOD-00.requirements"
    },
    {
      "from": "REQ-004.3",
      "to": "MOD-00",
      "relation": "satisfy",
      "evidence": "MOD-00.requirements"
    },
    {
      "from": "REQ-004.4",
      "to": "MOD-00",
      "relation": "satisfy",
      "evidence": "MOD-00.requirements"
    },
    {
      "from": "REQ-004.5",
      "to": "MOD-00",
      "relation": "satisfy",
      "evidence": "MOD-00.requirements"
    },
    {
      "from": "REQ-001.1",
      "to": "MOD-01",
      "relation": "satisfy",
      "evidence": "MOD-01.requirements"
    },
    {
      "from": "REQ-001.1.1",
      "to": "MOD-11",
      "relation": "satisfy",
      "evidence": "MOD-11.requirements"
    },
    {
      "from": "REQ-001.1.1.1",
      "to": "MOD-11",
      "relation": "satisfy",
      "evidence": "MOD-11.requirements"
    },
    {
      "from": "REQ-001.1.1.2",
      "to": "MOD-11",
      "relation": "satisfy",
      "evidence": "MOD-11.requirements"
    },
    {
      "from": "REQ-001.1.1.3",
      "to": "MOD-11",
      "relation": "satisfy",
      "evidence": "MOD-11.requirements"
    },
    {
      "from": "REQ-001.1.1.4",
      "to": "MOD-11",
      "relation": "satisfy",
      "evidence": "MOD-11.requirements"
    },
    {
      "from": "MOD-11",
      "to": "LAY-01",
      "relation": "allocate",
      "evidence": "MOD-11.layer"
    },
    {
      "from": "REQ-001.1.2",
      "to": "MOD-12",
      "relation": "satisfy",
      "evidence": "MOD-12.requirements"
    },
    {
      "from": "REQ-001.1.2.1",
      "to": "MOD-12",
      "relation": "satisfy",
      "evidence": "MOD-12.requirements"
    },
    {
      "from": "REQ-001.1.2.2",
      "to": "MOD-12",
      "relation": "satisfy",
      "evidence": "MOD-12.requirements"
    },
    {
      "from": "REQ-001.1.2.3",
      "to": "MOD-12",
      "relation": "satisfy",
      "evidence": "MOD-12.requirements"
    },
    {
      "from": "MOD-12",
      "to": "LAY-01",
      "relation": "allocate",
      "evidence": "MOD-12.layer"
    },
    {
      "from": "REQ-001.2",
      "to": "MOD-02",
      "relation": "satisfy",
      "evidence": "MOD-02.requirements"
    },
    {
      "from": "REQ-001.2.1",
      "to": "MOD-21",
      "relation": "satisfy",
      "evidence": "MOD-21.requirements"
    },
    {
      "from": "MOD-21",
      "to": "LAY-01",
      "relation": "allocate",
      "evidence": "MOD-21.layer"
    },
    {
      "from": "REQ-001.2.2",
      "to": "MOD-22",
      "relation": "satisfy",
      "evidence": "MOD-22.requirements"
    },
    {
      "from": "MOD-22",
      "to": "LAY-01",
      "relation": "allocate",
      "evidence": "MOD-22.layer"
    },
    {
      "from": "REQ-001.3",
      "to": "MOD-03",
      "relation": "satisfy",
      "evidence": "MOD-03.requirements"
    },
    {
      "from": "REQ-001.3.1",
      "to": "MOD-31",
      "relation": "satisfy",
      "evidence": "MOD-31.requirements"
    },
    {
      "from": "REQ-001.3.1.1",
      "to": "MOD-31",
      "relation": "satisfy",
      "evidence": "MOD-31.requirements"
    },
    {
      "from": "REQ-001.3.1.2",
      "to": "MOD-31",
      "relation": "satisfy",
      "evidence": "MOD-31.requirements"
    },
    {
      "from": "REQ-001.3.1.3",
      "to": "MOD-31",
      "relation": "satisfy",
      "evidence": "MOD-31.requirements"
    },
    {
      "from": "MOD-31",
      "to": "LAY-01",
      "relation": "allocate",
      "evidence": "MOD-31.layer"
    },
    {
      "from": "REQ-001.3.2",
      "to": "MOD-32",
      "relation": "satisfy",
      "evidence": "MOD-32.requirements"
    },
    {
      "from": "REQ-001.3.2.1",
      "to": "MOD-32",
      "relation": "satisfy",
      "evidence": "MOD-32.requirements"
    },
    {
      "from": "MOD-32",
      "to": "LAY-01",
      "relation": "allocate",
      "evidence": "MOD-32.layer"
    },
    {
      "from": "REQ-001.4",
      "to": "MOD-04",
      "relation": "satisfy",
      "evidence": "MOD-04.requirements"
    },
    {
      "from": "MOD-04",
      "to": "LAY-01",
      "relation": "allocate",
      "evidence": "MOD-04.layer"
    },
    {
      "from": "REQ-001.5",
      "to": "MOD-05",
      "relation": "satisfy",
      "evidence": "MOD-05.requirements"
    },
    {
      "from": "REQ-001.5.1",
      "to": "MOD-51",
      "relation": "satisfy",
      "evidence": "MOD-51.requirements"
    },
    {
      "from": "MOD-51",
      "to": "LAY-01",
      "relation": "allocate",
      "evidence": "MOD-51.layer"
    },
    {
      "from": "REQ-001.5.2",
      "to": "MOD-52",
      "relation": "satisfy",
      "evidence": "MOD-52.requirements"
    },
    {
      "from": "MOD-52",
      "to": "LAY-01",
      "relation": "allocate",
      "evidence": "MOD-52.layer"
    },
    {
      "from": "REQ-001.5.3",
      "to": "MOD-53",
      "relation": "satisfy",
      "evidence": "MOD-53.requirements"
    },
    {
      "from": "MOD-53",
      "to": "LAY-01",
      "relation": "allocate",
      "evidence": "MOD-53.layer"
    },
    {
      "from": "REQ-001.6",
      "to": "MOD-06",
      "relation": "satisfy",
      "evidence": "MOD-06.requirements"
    },
    {
      "from": "REQ-001.6.1",
      "to": "MOD-61",
      "relation": "satisfy",
      "evidence": "MOD-61.requirements"
    },
    {
      "from": "MOD-61",
      "to": "LAY-01",
      "relation": "allocate",
      "evidence": "MOD-61.layer"
    },
    {
      "from": "REQ-001.6.2",
      "to": "MOD-62",
      "relation": "satisfy",
      "evidence": "MOD-62.requirements"
    },
    {
      "from": "MOD-62",
      "to": "LAY-01",
      "relation": "allocate",
      "evidence": "MOD-62.layer"
    },
    {
      "from": "REQ-001.6.3",
      "to": "MOD-63",
      "relation": "satisfy",
      "evidence": "MOD-63.requirements"
    },
    {
      "from": "MOD-63",
      "to": "LAY-01",
      "relation": "allocate",
      "evidence": "MOD-63.layer"
    },
    {
      "from": "REQ-001.7",
      "to": "MOD-07",
      "relation": "satisfy",
      "evidence": "MOD-07.requirements"
    },
    {
      "from": "MOD-07",
      "to": "LAY-01",
      "relation": "allocate",
      "evidence": "MOD-07.layer"
    },
    {
      "from": "REQ-001.8",
      "to": "MOD-08",
      "relation": "satisfy",
      "evidence": "MOD-08.requirements"
    },
    {
      "from": "REQ-001.8.1",
      "to": "MOD-81",
      "relation": "satisfy",
      "evidence": "MOD-81.requirements"
    },
    {
      "from": "MOD-81",
      "to": "LAY-01",
      "relation": "allocate",
      "evidence": "MOD-81.layer"
    },
    {
      "from": "REQ-001.8.2",
      "to": "MOD-82",
      "relation": "satisfy",
      "evidence": "MOD-82.requirements"
    },
    {
      "from": "MOD-82",
      "to": "LAY-01",
      "relation": "allocate",
      "evidence": "MOD-82.layer"
    },
    {
      "from": "REQ-001.8.3",
      "to": "MOD-83",
      "relation": "satisfy",
      "evidence": "MOD-83.requirements"
    },
    {
      "from": "MOD-83",
      "to": "LAY-01",
      "relation": "allocate",
      "evidence": "MOD-83.layer"
    },
    {
      "from": "REQ-001.8.4",
      "to": "MOD-84",
      "relation": "satisfy",
      "evidence": "MOD-84.requirements"
    },
    {
      "from": "MOD-84",
      "to": "LAY-01",
      "relation": "allocate",
      "evidence": "MOD-84.layer"
    },
    {
      "from": "REQ-001.8.5",
      "to": "MOD-85",
      "relation": "satisfy",
      "evidence": "MOD-85.requirements"
    },
    {
      "from": "MOD-85",
      "to": "LAY-01",
      "relation": "allocate",
      "evidence": "MOD-85.layer"
    },
    {
      "from": "REQ-001.9",
      "to": "MOD-09",
      "relation": "satisfy",
      "evidence": "MOD-09.requirements"
    },
    {
      "from": "REQ-001.9.1",
      "to": "MOD-91",
      "relation": "satisfy",
      "evidence": "MOD-91.requirements"
    },
    {
      "from": "MOD-91",
      "to": "LAY-01",
      "relation": "allocate",
      "evidence": "MOD-91.layer"
    },
    {
      "from": "REQ-001.9.2",
      "to": "MOD-92",
      "relation": "satisfy",
      "evidence": "MOD-92.requirements"
    },
    {
      "from": "MOD-92",
      "to": "LAY-01",
      "relation": "allocate",
      "evidence": "MOD-92.layer"
    },
    {
      "from": "REQ-005",
      "to": "MOD-10",
      "relation": "satisfy",
      "evidence": "MOD-10.requirements"
    },
    {
      "from": "REQ-005.1",
      "to": "MOD-10",
      "relation": "satisfy",
      "evidence": "MOD-10.requirements"
    },
    {
      "from": "REQ-005.2",
      "to": "MOD-10",
      "relation": "satisfy",
      "evidence": "MOD-10.requirements"
    },
    {
      "from": "REQ-005.3",
      "to": "MOD-10",
      "relation": "satisfy",
      "evidence": "MOD-10.requirements"
    },
    {
      "from": "REQ-005.4",
      "to": "MOD-10",
      "relation": "satisfy",
      "evidence": "MOD-10.requirements"
    },
    {
      "from": "MOD-10",
      "to": "LAY-03",
      "relation": "allocate",
      "evidence": "MOD-10.layer"
    },
    {
      "from": "REQ-003",